{
    "advisory": {
        "id": 10001,
        "cwe": "CWE-94"
    },
    "correct_cwe": "CWE-78",
    "correct_package_link": "https://registry.npmjs.org/pack/-/pack-0.1.22.tgz",
    "vulnerability": {
        "fail_reason": "Insufficient information in Overview, External References or Tool Reports. Could not execute vulnerable code to test vulnerability because of ..."
    },
    "poc": [
        {
            "url": "exploitdb.com/package/poc-example"
        }
    ],
    "patch": [
        {
            "url": "github.com/package/commit/commitid"
        }
    ],
    "tools": {
        "codeql": {
            "score": "D"
        },
        "njsscan": {
            "score": "D"
        },
        "graudit": {
            "score": "D"
        },
        "insidersec": {
            "score": "C"
        },
        "eslint": {
            "score": "C"
        },
        "appinspector": {
            "score": "D"
        },
        "msdevskim": {
            "score": "C"
        },
        "drek": {
            "score": "D"
        },
        "mosca": {
            "score": "C"
        }
    }
}