{
    "advisory": {
        "id": 10000,
        "cwe": "CWE-94"
    },
    "correct_cwe": "CWE-78",
    "correct_package_link": "https://registry.npmjs.org/pack/-/pack-0.1.22.tgz",
    "vulnerability": {
        "vulnerability_location": [
            {
                "source": {
                    "file": "index.js",
                    "lineno": 11,
                    "code": "function (req, res) {"
                },
                "sink": {
                    "file": "index.js",
                    "lineno": 20,
                    "code": "exec(req.command);"
                }
            }
        ],
        "fail_reason": ""
    },
    "poc": [
        {
            "url": "exploitdb.com/package/poc-example"
        }
    ],
    "patch": [
        {
            "url": "github.com/package/commit/commitid"
        }
    ],
    "tools": {
        "codeql": {
            "score": "C"
        },
        "njsscan": {
            "score": "C"
        },
        "graudit": {
            "score": "B"
        },
        "insidersec": {
            "score": "C"
        },
        "eslint": {
            "score": "D"
        },
        "appinspector": {
            "score": "C"
        },
        "msdevskim": {
            "score": "C"
        },
        "drek": {
            "score": "D"
        },
        "mosca": {
            "score": "B"
        }
    }
}